{
  "$schema": "https://open-design.ai/schemas/plugin.v1.json",
  "specVersion": "1.0.0",
  "name": "example-html-ppt-xhs-white-editorial",
  "title": "Html Ppt Xhs White Editorial",
  "title_i18n": {
    "zh-CN": "Html Ppt Xhs 白底编辑风",
    "zh-TW": "Html Ppt Xhs 白底編輯風",
    "ja": "Html Ppt Xhs ホワイト編集風",
    "ko": "Html Ppt Xhs 화이트 에디토리얼",
    "de": "Html Ppt Xhs White Editorial",
    "fr": "Html Ppt Xhs White Editorial",
    "ru": "Html Ppt Xhs White Editorial",
    "es": "Html Ppt Xhs White Editorial",
    "pt-BR": "Html Ppt Xhs White Editorial",
    "it": "Html Ppt Xhs White Editorial",
    "vi": "Html Ppt Xhs White Editorial",
    "pl": "Html Ppt Xhs White Editorial",
    "id": "Html Ppt Xhs White Editorial",
    "nl": "Html Ppt Xhs White Editorial",
    "ar": "Html Ppt Xhs White Editorial",
    "tr": "Html Ppt Xhs White Editorial",
    "uk": "Html Ppt Xhs White Editorial",
    "en": "Html Ppt Xhs White Editorial"
  },
  "version": "0.1.0",
  "description": "白底杂志风 deck — 纯白背景 + 顶部 10 色彩虹 bar、80-110px display 标题、紫→蓝→绿→橙→粉渐变文字、马卡龙软卡片组（粉/紫/蓝/绿/橙）、黑底白字 .focus pill、引用大块。同时适合发小红书图文 + 横版 PPT 双用。",
  "description_i18n": {
    "zh-CN": "白底杂志风 deck — 纯白背景 + 顶部 10 色彩虹 bar、80-110px display 标题、紫→蓝→绿→橙→粉渐变文字、马卡龙软卡片组（粉/紫/蓝/绿/橙）、黑底白字 .focus pill、引用大块。同时适合发小红书图文 + 横版 PPT 双用。",
    "zh-TW": "白底雜誌風 deck — 純白背景 + 頂部 10 色彩虹 bar、80-110px display 標題、紫→藍→綠→橙→粉漸變文字、馬卡龍軟卡片組（粉/紫/藍/綠/橙）、黑底白字 .focus pill、引用大塊。同時適合發小紅書圖文 + 橫版 PPT 雙用。",
    "ja": "白背景の雑誌風デッキ — 純白背景 + 上部10色レインボーバー、80-110pxディスプレイタイトル、紫→青→緑→オレンジ→ピンクのグラデーション文字、マカロンソフトカード（ピンク/紫/青/緑/オレンジ）、黒背景白文字.focusピル、引用ブロック。小紅書の画像投稿と横型PPTの両方に対応。",
    "ko": "화이트 배경 매거진 스타일 덱 — 순백 배경 + 상단 10색 레인보우 바, 80-110px 디스플레이 제목, 보라→파랑→초록→주황→핑크 그라데이션 텍스트, 마카롱 소프트 카드(핑크/보라/파랑/초록/주황), 검정 배경 흰색 글자 .focus pill, 인용 블록. 샤오홍슈 이미지 게시물과 가로형 PPT 모두 사용 가능.",
    "de": "Weißer Magazin-Stil-Deck — reiner weißer Hintergrund + 10-farbige Regenbogenleiste oben, 80-110px Display-Titel, lila→blau→grün→orange→rosa Verlaufstext, Makronen-Soft-Karten (rosa/lila/blau/grün/orange), schwarzer Hintergrund weiße Schrift .focus Pill, Zitatblöcke. Für Xiaohongshu-Beiträge und Querformat-PPT geeignet.",
    "fr": "Deck style magazine fond blanc — fond blanc pur + barre arc-en-ciel 10 couleurs en haut, titre display 80-110px, texte dégradé violet→bleu→vert→orange→rose, cartes douces macaron (rose/violet/bleu/vert/orange), pill .focus fond noir texte blanc, blocs de citation. Adapté pour Xiaohongshu et PPT format paysage.",
    "ru": "Журнальный стиль с белым фоном — чисто белый фон + радужная полоса из 10 цветов вверху, заголовки 80-110px, градиентный текст фиолетовый→синий→зелёный→оранжевый→розовый, мягкие карточки макарон (розовый/фиолетовый/синий/зелёный/оранжевый), .focus pill с чёрным фоном и белым текстом, блоки цитат. Подходит для Xiaohongshu и горизонтальных PPT.",
    "es": "Deck estilo revista fondo blanco — fondo blanco puro + barra arcoíris de 10 colores en la parte superior, título display 80-110px, texto degradado morado→azul→verde→naranja→rosa, tarjetas suaves macaron (rosa/morado/azul/verde/naranja), pill .focus fondo negro texto blanco, bloques de cita. Apto para publicaciones de Xiaohongshu y PPT horizontal.",
    "pt-BR": "Deck estilo revista fundo branco — fundo branco puro + barra arco-íris de 10 cores no topo, título display 80-110px, texto gradiente roxo→azul→verde→laranja→rosa, cards macios macaron (rosa/roxo/azul/verde/laranja), pill .focus fundo preto texto branco, blocos de citação. Adequado para posts no Xiaohongshu e PPT horizontal.",
    "it": "Deck stile magazine sfondo bianco — sfondo bianco puro + barra arcobaleno 10 colori in alto, titolo display 80-110px, testo sfumato viola→blu→verde→arancione→rosa, card morbide macaron (rosa/viola/blu/verde/arancione), pill .focus sfondo nero testo bianco, blocchi citazione. Adatto per post Xiaohongshu e PPT orizzontale.",
    "vi": "Deck phong cách tạp chí nền trắng — nền trắng tinh khiết + thanh cầu vồng 10 màu ở trên, tiêu đề display 80-110px, văn bản gradient tím→xanh→xanh lá→cam→hồng, thẻ mềm macaron (hồng/tím/xanh/xanh lá/cam), pill .focus nền đen chữ trắng, khối trích dẫn. Phù hợp cho bài đăng Xiaohongshu và PPT ngang.",
    "pl": "Deck w stylu magazynu z białym tłem — czyste białe tło + tęczowy pasek 10 kolorów u góry, tytuł display 80-110px, tekst gradientowy fioletowy→niebieski→zielony→pomarańczowy→różowy, miękkie karty macaron (różowy/fioletowy/niebieski/zielony/pomarańczowy), pill .focus czarne tło biały tekst, bloki cytatów. Odpowiedni dla postów Xiaohongshu i poziomych PPT.",
    "id": "Deck gaya majalah latar putih — latar putih murni + bar pelangi 10 warna di atas, judul display 80-110px, teks gradien ungu→biru→hijau→oranye→pink, kartu lembut macaron (pink/ungu/biru/hijau/oranye), pill .focus latar hitam teks putih, blok kutipan. Cocok untuk postingan Xiaohongshu dan PPT horizontal.",
    "nl": "Deck in tijdschriftstijl met witte achtergrond — zuiver witte achtergrond + regenboogbalk met 10 kleuren bovenaan, display-titel 80-110px, verlooptekst paars→blauw→groen→oranje→roze, zachte macaronkaarten (roze/paars/blauw/groen/oranje), .focus pill zwarte achtergrond witte tekst, citaatblokken. Geschikt voor Xiaohongshu-berichten en horizontale PPT.",
    "ar": "تصميم بأسلوب مجلة بخلفية بيضاء — خلفية بيضاء نقية + شريط قوس قزح 10 ألوان في الأعلى، عنوان عرض 80-110px، نص متدرج بنفسجي→أزرق→أخضر→برتقالي→وردي، بطاقات ناعمة ماكارون (وردي/بنفسجي/أزرق/أخضر/برتقالي)، حبة .focus خلفية سوداء نص أبيض، كتل اقتباس. مناسب لمنشورات Xiaohongshu وعروض PPT الأفقية.",
    "tr": "Beyaz arka planlı dergi stili deck — saf beyaz arka plan + üstte 10 renkli gökkuşağı çubuğu, 80-110px display başlık, mor→mavi→yeşil→turuncu→pembe degrade metin, yumuşak makaron kartlar (pembe/mor/mavi/yeşil/turuncu), .focus pill siyah arka plan beyaz metin, alıntı blokları. Xiaohongshu gönderileri ve yatay PPT için uygundur.",
    "uk": "Deck у журнальному стилі з білим фоном — чисто білий фон + райдужна смуга з 10 кольорів зверху, заголовок display 80-110px, градієнтний текст фіолетовий→синій→зелений→помаранчевий→рожевий, м'які картки макарон (рожевий/фіолетовий/синій/зелений/помаранчевий), .focus pill чорний фон білий текст, блоки цитат. Підходить для публікацій Xiaohongshu та горизонтальних PPT.",
    "en": "白底杂志风 deck — 纯白背景 + 顶部 10 色彩虹 bar、80-110px display 标题、紫→蓝→绿→橙→粉渐变文字、马卡龙软卡片组（粉/紫/蓝/绿/橙）、黑底白字 .focus pill、引用大块。同时适合发小红书图文 + 横版 PPT 双用。"
  },
  "license": "MIT",
  "author": {
    "name": "Joushen Studio",
    "url": "https://github.com/nexu-io"
  },
  "homepage": "https://github.com/nexu-io/open-design/tree/main/plugins/_official/examples/html-ppt-xhs-white-editorial",
  "tags": [
    "example",
    "first-party",
    "deck",
    "marketing",
    "web",
    "untitled",
    "xhs-editorial",
    "white-editorial",
    "editorial-deck"
  ],
  "compat": {
    "agentSkills": [
      {
        "path": "./SKILL.md"
      }
    ]
  },
  "od": {
    "kind": "scenario",
    "taskKind": "new-generation",
    "mode": "deck",
    "scenario": "marketing",
    "surface": "web",
    "preview": {
      "type": "html",
      "entry": "./example.html"
    },
    "useCase": {
      "query": {
        "en": "Use the html-ppt-xhs-white-editorial template to create a white-background magazine-style PPT. Key points: 80-110px display headlines, rainbow top bar, soft macaron cards, and black-background white-text .focus pills. First ask me for the topic and audience, then write 8-12 slides.",
        "zh-CN": "用 html-ppt-xhs-white-editorial 模板做一份白底杂志风 PPT，中文优先。要点：80-110px display 大标题、彩虹顶部 bar、马卡龙软卡片、黑底白字 .focus pill。先告诉我主题和受众，再写 8-12 页。"
      },
      "exampleOutputs": [
        {
          "path": "./example.html",
          "title": "Html Ppt Xhs White Editorial"
        }
      ]
    },
    "context": {
      "skills": [
        {
          "path": "./SKILL.md"
        }
      ],
      "assets": [
        "./example.html"
      ]
    },
    "pipeline": {
      "stages": [
        {
          "id": "generate",
          "atoms": [
            "file-write",
            "live-artifact"
          ]
        }
      ]
    },
    "capabilities": [
      "prompt:inject",
      "fs:write"
    ]
  }
}
