{
  "$schema": "https://open-design.ai/schemas/plugin.v1.json",
  "specVersion": "1.0.0",
  "name": "example-social-media-matrix-tracker-template",
  "title": "Social Media Matrix Tracker Template",
  "title_i18n": {
    "zh-CN": "社媒矩阵数据追踪面板模板",
    "zh-TW": "社群媒體矩陣追蹤面板範本",
    "ja": "ソーシャルメディアマトリックストラッカーテンプレート",
    "ko": "소셜 미디어 매트릭스 트래커 템플릿",
    "de": "Social Media Matrix Tracker Vorlage",
    "fr": "Modèle de suivi matriciel des médias sociaux",
    "ru": "Шаблон трекера матрицы социальных сетей",
    "es": "Plantilla de rastreador de matriz de redes sociales",
    "pt-BR": "Template de rastreador de matriz de mídias sociais",
    "it": "Template tracker matrice social media",
    "vi": "Mẫu theo dõi ma trận mạng xã hội",
    "pl": "Szablon trackera matrycy mediów społecznościowych",
    "id": "Template pelacak matriks media sosial",
    "nl": "Social media matrixtracker sjabloon",
    "ar": "قالب متتبع مصفوفة وسائل التواصل الاجتماعي",
    "tr": "Sosyal medya matris takip şablonu",
    "uk": "Шаблон трекера матриці соціальних мереж",
    "en": "Social Media Matrix Tracker Template"
  },
  "version": "0.1.0",
  "description": "社媒矩阵数据追踪面板模板（Social Media Matrix Tracker）。 Use when users ask for a cinematic, data-dense social media analytics dashboard with multi-platform metrics, interactive charts, hover insights, range compare, and dark/light theme switching in a single HTML artifact.",
  "description_i18n": {
    "zh-CN": "社媒矩阵数据追踪面板模板（Social Media Matrix Tracker）。适用于需要电影级、数据密集型社交媒体分析仪表板的场景，支持多平台指标、交互式图表、悬停洞察、范围对比和深浅主题切换，单个 HTML 文件即可实现。",
    "zh-TW": "社群媒體矩陣數據追蹤面板範本（Social Media Matrix Tracker）。適用於需要電影級、數據密集型社群媒體分析儀表板的場景，支援多平台指標、互動式圖表、懸停洞察、範圍比較和深淺主題切換，單一 HTML 檔案即可實現。",
    "ja": "ソーシャルメディアマトリックスデータ追跡パネルテンプレート（Social Media Matrix Tracker）。マルチプラットフォーム指標、インタラクティブチャート、ホバーインサイト、範囲比較、ダーク/ライトテーマ切り替えを備えた、映画的でデータ密度の高いソーシャルメディア分析ダッシュボードが必要な場合に使用。単一の HTML で実現可能。",
    "ko": "소셜 미디어 매트릭스 데이터 추적 패널 템플릿(Social Media Matrix Tracker). 멀티 플랫폼 지표, 인터랙티브 차트, 호버 인사이트, 범위 비교 및 다크/라이트 테마 전환을 지원하는 영화적이고 데이터 집약적인 소셜 미디어 분석 대시보드가 필요할 때 사용. 단일 HTML 파일로 구현 가능.",
    "de": "Social Media Matrix Daten-Tracking-Panel-Vorlage (Social Media Matrix Tracker). Für kinoreife, datenintensive Social-Media-Analyse-Dashboards mit Multiplattform-Metriken, interaktiven Charts, Hover-Insights, Bereichsvergleich und Hell-/Dunkel-Themenwechsel in einer einzelnen HTML-Datei.",
    "fr": "Modèle de tableau de bord de suivi des données de matrice de médias sociaux (Social Media Matrix Tracker). Pour créer des tableaux de bord analytiques cinématiques et riches en données avec métriques multi-plateformes, graphiques interactifs, aperçus au survol, comparaison de plages et basculement de thème clair/sombre dans un seul fichier HTML.",
    "ru": "Шаблон панели отслеживания данных матрицы социальных сетей (Social Media Matrix Tracker). Для создания кинематографичных, насыщенных данными аналитических дашбордов социальных сетей с мультиплатформенными метриками, интерактивными графиками, всплывающими подсказками, сравнением диапазонов и переключением темной/светлой темы в одном HTML-файле.",
    "es": "Plantilla de panel de seguimiento de datos de matriz de redes sociales (Social Media Matrix Tracker). Para crear dashboards analíticos cinematográficos y densos en datos con métricas multiplataforma, gráficos interactivos, insights al pasar el cursor, comparación de rangos y cambio de tema oscuro/claro en un solo archivo HTML.",
    "pt-BR": "Template de painel de rastreamento de dados de matriz de mídias sociais (Social Media Matrix Tracker). Para criar dashboards analíticos cinematográficos e densos em dados com métricas multiplataforma, gráficos interativos, insights ao passar o mouse, comparação de intervalos e alternância de tema claro/escuro em um único arquivo HTML.",
    "it": "Template pannello di tracciamento dati matrice social media (Social Media Matrix Tracker). Per creare dashboard analitici cinematografici e ricchi di dati con metriche multipiattaforma, grafici interattivi, insight al passaggio del mouse, confronto intervalli e cambio tema chiaro/scuro in un singolo file HTML.",
    "vi": "Mẫu bảng điều khiển theo dõi dữ liệu ma trận mạng xã hội (Social Media Matrix Tracker). Dùng để tạo dashboard phân tích đậm chất điện ảnh, dữ liệu dày đặc với chỉ số đa nền tảng, biểu đồ tương tác, thông tin chi tiết khi di chuột, so sánh phạm vi và chuyển đổi giao diện sáng/tối trong một file HTML duy nhất.",
    "pl": "Szablon panelu śledzenia danych matrycy mediów społecznościowych (Social Media Matrix Tracker). Do tworzenia kinowych, gęstych danymi dashboardów analitycznych z metrykami wieloplatformowymi, interaktywnymi wykresami, podglądem po najechaniu, porównaniem zakresów i przełączaniem motywu jasnego/ciemnego w jednym pliku HTML.",
    "id": "Template panel pelacakan data matriks media sosial (Social Media Matrix Tracker). Untuk membuat dashboard analitik media sosial yang sinematik dan padat data dengan metrik multi-platform, grafik interaktif, wawasan saat hover, perbandingan rentang, dan pergantian tema gelap/terang dalam satu file HTML.",
    "nl": "Social media matrix data tracking paneel sjabloon (Social Media Matrix Tracker). Voor het maken van filmische, datadichte social media analytische dashboards met multi-platform metrics, interactieve grafieken, hover-inzichten, bereiksvergelijking en donker/licht thema wisseling in één HTML-bestand.",
    "ar": "قالب لوحة تتبع بيانات مصفوفة وسائل التواصل الاجتماعي (Social Media Matrix Tracker). لإنشاء لوحات تحليلية سينمائية كثيفة البيانات مع مقاييس متعددة المنصات ورسوم بيانية تفاعلية ورؤى عند التمرير ومقارنة النطاقات والتبديل بين السمة الفاتحة والداكنة في ملف HTML واحد.",
    "tr": "Sosyal medya matrisi veri takip paneli şablonu (Social Media Matrix Tracker). Multi-platform metrikler, etkileşimli grafikler, hover içgörüler, aralık karşılaştırması ve koyu/açık tema geçişi ile sinematik, veri yoğun sosyal medya analitik panoları oluşturmak için tek bir HTML dosyasında.",
    "uk": "Шаблон панелі відстеження даних матриці соціальних мереж (Social Media Matrix Tracker). Для створення кінематографічних, насичених даними аналітичних дашбордів соцмереж з мультиплатформними метриками, інтерактивними графіками, спливаючими підказками, порівнянням діапазонів та перемиканням темної/світлої теми в одному HTML-файлі.",
    "en": "社媒矩阵数据追踪面板模板（Social Media Matrix Tracker）。 Use when users ask for a cinematic, data-dense social media analytics dashboard with multi-platform metrics, interactive charts, hover insights, range compare, and dark/light theme switching in a single HTML artifact."
  },
  "license": "MIT",
  "author": {
    "name": "Joushen Studio",
    "url": "https://github.com/nexu-io"
  },
  "homepage": "https://github.com/nexu-io/open-design/tree/main/plugins/_official/examples/social-media-matrix-tracker-template",
  "tags": [
    "example",
    "first-party",
    "template",
    "live-artifacts",
    "web",
    "desktop",
    "social-media-matrix-tracker",
    "social-media-dashboard-template",
    "creator-analytics-template",
    "live-social-dashboard",
    "social-analytics",
    "content-performance",
    "tiktok-analytics-dashboard",
    "instagram-analytics-dashboard",
    "youtube-analytics-dashboard",
    "multi-platform-creator-dashboard",
    "untitled"
  ],
  "compat": {
    "agentSkills": [
      {
        "path": "./SKILL.md"
      }
    ]
  },
  "od": {
    "kind": "scenario",
    "taskKind": "new-generation",
    "mode": "template",
    "platform": "desktop",
    "scenario": "live-artifacts",
    "surface": "web",
    "preview": {
      "type": "html",
      "entry": "./example.html"
    },
    "useCase": {
      "query": {
        "en": "Create a social media matrix tracker dashboard template using my DESIGN.md. Keep the cinematic glassmorphism style, multi-chart analytics sections, hover tooltips, pin/drag range analysis, and light/dark switching.",
        "zh-CN": "使用这个插件完成以下任务：Create a social media matrix tracker dashboard template using my DESIGN.md. Keep the cinematic glassmorphism style, multi-chart analytics sections, hover tooltips, pin/drag range analysis, and light/dark switching."
      },
      "exampleOutputs": [
        {
          "path": "./example.html",
          "title": "Social Media Matrix Tracker Template"
        }
      ]
    },
    "context": {
      "skills": [
        {
          "path": "./SKILL.md"
        }
      ],
      "designSystem": {
        "primary": true
      },
      "assets": [
        "./example.html",
        "./assets/template.html",
        "./references/checklist.md"
      ]
    },
    "pipeline": {
      "stages": [
        {
          "id": "generate",
          "atoms": [
            "file-write",
            "live-artifact"
          ]
        }
      ]
    },
    "capabilities": [
      "prompt:inject",
      "fs:write"
    ]
  }
}
