{
  "$schema": "https://open-design.ai/schemas/plugin.v1.json",
  "specVersion": "1.0.0",
  "name": "example-dcf-valuation",
  "title": "Dcf Valuation",
  "title_i18n": {
    "zh-CN": "DCF估值",
    "zh-TW": "DCF估值",
    "ja": "DCF評価",
    "ko": "DCF 밸류에이션",
    "de": "DCF-Bewertung",
    "fr": "Valorisation DCF",
    "ru": "DCF-оценка",
    "es": "Valoración DCF",
    "pt-BR": "Valuation DCF",
    "it": "Valutazione DCF",
    "vi": "Định giá DCF",
    "pl": "Wycena DCF",
    "id": "Valuasi DCF",
    "nl": "DCF-waardering",
    "ar": "تقييم DCF",
    "tr": "DCF Değerleme",
    "uk": "DCF-оцінка",
    "en": "Dcf Valuation"
  },
  "version": "0.1.0",
  "description": "Discounted cash flow valuation and intrinsic value analysis for public companies. Use when the brief asks for DCF, fair value, intrinsic value, price target, undervalued or overvalued analysis, or \"what is this company worth?\"",
  "description_i18n": {
    "zh-CN": "为上市公司提供现金流折现估值和内在价值分析。适用于DCF、公允价值、内在价值、目标价、低估或高估分析等需求。",
    "zh-TW": "為上市公司提供現金流折現估值和內在價值分析。適用於DCF、公允價值、內在價值、目標價、低估或高估分析等需求。",
    "ja": "上場企業向けの割引キャッシュフロー評価と本質的価値分析。DCF、適正価値、本質的価値、目標株価、過小評価・過大評価分析などに対応。",
    "ko": "상장 기업의 현금흐름할인 평가 및 내재가치 분석. DCF, 공정가치, 내재가치, 목표주가, 저평가 또는 고평가 분석 등에 사용.",
    "de": "Discounted-Cashflow-Bewertung und innere Wertanalyse für börsennotierte Unternehmen. Geeignet für DCF, fairer Wert, intrinsischer Wert, Kursziel und Über-/Unterbewertungsanalysen.",
    "fr": "Valorisation par flux de trésorerie actualisés et analyse de valeur intrinsèque pour les sociétés cotées. Pour DCF, juste valeur, valeur intrinsèque, prix cible et analyses de sur/sous-évaluation.",
    "ru": "Оценка компаний методом дисконтированных денежных потоков и анализ внутренней стоимости. Для DCF, справедливой стоимости, целевой цены и анализа недо- или переоценки.",
    "es": "Valoración por flujo de caja descontado y análisis de valor intrínseco para empresas públicas. Para DCF, valor justo, valor intrínseco, precio objetivo y análisis de sobre/infravaloración.",
    "pt-BR": "Avaliação por fluxo de caixa descontado e análise de valor intrínseco para empresas de capital aberto. Para DCF, valor justo, valor intrínseco, preço-alvo e análise de sobre/subvalorização.",
    "it": "Valutazione dei flussi di cassa scontati e analisi del valore intrinseco per aziende quotate. Per DCF, valore equo, valore intrinseco, prezzo obiettivo e analisi di sovra/sottovalutazione.",
    "vi": "Định giá dòng tiền chiết khấu và phân tích giá trị nội tại cho công ty đại chúng. Dùng cho DCF, giá trị hợp lý, giá trị nội tại, giá mục tiêu và phân tích định giá thấp/cao.",
    "pl": "Wycena metodą zdyskontowanych przepływów pieniężnych i analiza wartości wewnętrznej spółek giełdowych. Do DCF, wartości godziwej, ceny docelowej i analizy prze/niedowartościowania.",
    "id": "Valuasi arus kas terdiskon dan analisis nilai intrinsik untuk perusahaan publik. Untuk DCF, nilai wajar, nilai intrinsik, target harga, dan analisis undervalued atau overvalued.",
    "nl": "Geactualiseerde cashflowwaardering en intrinsieke waarde-analyse voor beursgenoteerde bedrijven. Voor DCF, reële waarde, intrinsieke waarde, koersdoel en onder/overwaarderingsanalyses.",
    "ar": "تقييم التدفقات النقدية المخصومة وتحليل القيمة الجوهرية للشركات المدرجة. للاستخدام في DCF والقيمة العادلة والقيمة الجوهرية والسعر المستهدف وتحليل التقييم المنخفض أو المرتفع.",
    "tr": "Halka açık şirketler için iskontolu nakit akışı değerlemesi ve içsel değer analizi. DCF, gerçeğe uygun değer, içsel değer, hedef fiyat ve düşük/yüksek değerlenme analizleri için.",
    "uk": "Оцінка компаній методом дисконтованих грошових потоків і аналіз внутрішньої вартості. Для DCF, справедливої вартості, цільової ціни та аналізу недо- чи переоцінки.",
    "en": "Discounted cash flow valuation and intrinsic value analysis for public companies. Use when the brief asks for DCF, fair value, intrinsic value, price target, undervalued or overvalued analysis, or \"what is this company worth?\""
  },
  "license": "MIT",
  "author": {
    "name": "Joushen Studio",
    "url": "https://github.com/nexu-io"
  },
  "homepage": "https://github.com/nexu-io/open-design/tree/main/plugins/_official/examples/dcf-valuation",
  "tags": [
    "example",
    "first-party",
    "prototype",
    "design",
    "web",
    "dcf",
    "discounted-cash-flow",
    "intrinsic-value",
    "fair-value",
    "price-target",
    "undervalued",
    "overvalued",
    "untitled"
  ],
  "compat": {
    "agentSkills": [
      {
        "path": "./SKILL.md"
      }
    ]
  },
  "od": {
    "kind": "scenario",
    "taskKind": "new-generation",
    "mode": "prototype",
    "scenario": "design",
    "surface": "web",
    "preview": {
      "type": "markdown",
      "entry": "./example.html"
    },
    "useCase": {
      "query": {
        "en": "Discounted cash flow valuation and intrinsic value analysis for public companies. Use when the brief asks for DCF, fair value, intrinsic value, price target, undervalued or overvalued analysis, or \"what is this company worth?\"",
        "zh-CN": "使用这个插件完成以下任务：Discounted cash flow valuation and intrinsic value analysis for public companies. Use when the brief asks for DCF, fair value, intrinsic value, price target, undervalued or overvalued analysis, or \"what is this company worth?\""
      }
    },
    "context": {
      "skills": [
        {
          "path": "./SKILL.md"
        }
      ],
      "designSystem": {
        "primary": true
      },
      "assets": [
        "./references/sector-wacc.md"
      ]
    },
    "pipeline": {
      "stages": [
        {
          "id": "generate",
          "atoms": [
            "file-write",
            "live-artifact"
          ]
        }
      ]
    },
    "capabilities": [
      "prompt:inject",
      "fs:write"
    ]
  }
}
